{
  "schema_version": "x-img.rc-compatibility.v1",
  "manifest_id": "pinakotheke-1.29.0-rc.1-compatibility",
  "release": {
    "target_version": "1.29.0-rc.1",
    "deb_version": "1.29.0~rc.1",
    "rpm_version": "1.29.0",
    "rpm_release": "0.rc.1",
    "macos_pkg_version": "1.29.0.1",
    "firefox_manifest_version": "1.29.0.1",
    "firefox_version_name": "1.29.0-rc.1",
    "status": "release_ready"
  },
  "pinakotheke": {
    "repository": "https://github.com/sagrudd/pinakotheke",
    "tested_commit": "d2cd46e7499ed74efaf9100c1fc8e41f3592ef43",
    "baseline_version": "1.29.0-rc.1",
    "working_tree": "clean",
    "version_sources": [
      {
        "kind": "cargo_workspace",
        "path": "Cargo.toml",
        "selector": "workspace.package.version"
      },
      {
        "kind": "firefox_json_pointer",
        "path": "firefox-extension/manifest.json",
        "selector": "/version"
      },
      {
        "kind": "json_pointer",
        "path": "firefox-extension/manifest.json",
        "selector": "/version_name"
      },
      {
        "kind": "json_pointer",
        "path": "contracts/monas/x-img-product-bootstrap.v1.json",
        "selector": "/product_version"
      },
      {
        "kind": "json_pointer",
        "path": "contracts/synoptikon/pinakotheke-product-manifest.v1.json",
        "selector": "/product/version"
      }
    ]
  },
  "dependencies": {
    "monas": {
      "repository": "https://github.com/sagrudd/monas",
      "tested_commit": "dbcc70577d28f2c4a619eafeaee9e399798bec5c",
      "tested_version": "0.9.1",
      "tested_components": [
        {"name": "monas-core", "version": "0.9.1"},
        {"name": "monas-server", "version": "0.9.1"},
        {"name": "monas-web", "version": "0.9.1"}
      ],
      "minimum_version": "0.9.1",
      "evidence_status": "verified",
      "working_tree": "clean",
      "required_capabilities": [
        "monas.prosopikon-authenticated-host-context.v1",
        "monas.process-scoped-session-revocation.v1",
        "monas.pinakotheke-streaming-forward.v1",
        "monas.pinakotheke-device-pairing.v1",
        "monas.pinakotheke-runtime-compatibility-health.v1"
      ],
      "missing_required_capabilities": [],
      "wire_contracts": [
        {
          "contract_version": "x-img.monas-product-bootstrap.v1",
          "path": "contracts/monas/x-img-product-bootstrap.v1.json",
          "sha256": "04ec39f91a2f9bab2ea576ff42a21f4dec7b03b38f2daa8172491b541448ff2d"
        },
        {
          "contract_version": "pinakotheke.capture-authority.v1",
          "path": "contracts/monas/pinakotheke-capture-authority.v1.schema.json",
          "sha256": "018b419112e0214966184c4f4ff302ea9e4a107af754a69e444334af72121b3b"
        }
      ]
    },
    "dasobjectstore": {
      "repository": "https://github.com/sagrudd/DASObjectStore",
      "tested_commit": "f8ac52f930a440ab725b6ecb61ef6c8fac8d535e",
      "tested_version": "0.145.3",
      "tested_components": [
        {"name": "dasobjectstore-core", "version": "0.145.3"},
        {"name": "dasobjectstore-daemon", "version": "0.145.3"},
        {"name": "dasobjectstore-remote", "version": "0.145.3"}
      ],
      "minimum_version": "0.145.3",
      "evidence_status": "verified",
      "working_tree": "clean",
      "required_capabilities": [
        "dasobjectstore.application-stream-ingest.v1",
        "dasobjectstore.authorized-object-read.v1",
        "dasobjectstore.application-upload-completion.v1",
        "dasobjectstore.exact-object-delete.v1",
        "dasobjectstore.application-delete-capacity-reconciliation.v1"
      ],
      "missing_required_capabilities": [],
      "wire_contracts": [
        {
          "contract_version": "x-img.das-application-identity.v1",
          "path": "contracts/dasobjectstore/x-img-application-identity.v1.json",
          "sha256": "5c67211933f339d04b1d33cca1bd24708d44bc7c94618e9a5b01d03825246242"
        },
        {
          "contract_version": "pinakotheke.das-stream-ingest-helper.v1",
          "path": "contracts/dasobjectstore/pinakotheke-das-stream-ingest-helper.v1.schema.json",
          "sha256": "4f77cd809be0fd7b77c41b1caa2bd2628dd39aa582f5c01dafaba554e3e96b7b"
        },
        {
          "contract_version": "pinakotheke.das-object-delete-helper.v1",
          "path": "contracts/dasobjectstore/pinakotheke-das-object-delete-helper.v1.schema.json",
          "sha256": "ac4176f34bd1bbab6014fddd31b213867674373da730019976fe8f98cb95c526"
        }
      ]
    },
    "mnemosyne": {
      "repository": "https://github.com/sagrudd/mnemosyne",
      "tested_commit": "2244a49f5057ef6251b2760bd0729de8e2207f56",
      "tested_version": null,
      "tested_components": [
        {"name": "mneion-api-types", "version": "0.21.1"},
        {"name": "mnemosyne-product-sdk", "version": "0.2.1"}
      ],
      "minimum_version": null,
      "evidence_status": "verified",
      "working_tree": "clean",
      "required_capabilities": [
        "mnemosyne.product-sdk.v1",
        "mnemosyne.product-manifest.v1"
      ],
      "missing_required_capabilities": [],
      "wire_contracts": [
        {
          "contract_version": "mnemosyne.product.manifest.v1",
          "path": "contracts/synoptikon/pinakotheke-product-manifest.v1.json",
          "sha256": "43102e74983e6e1669be1238fa80a611edbaad106f54fa69e278e9e9cdf661fd"
        }
      ]
    },
    "mnemosyne_design_language": {
      "repository": "https://github.com/sagrudd/mnemosyne_design_language",
      "tested_commit": "fbfa28e55d1c8111ef95a139d83927c231534b5f",
      "tested_version": "0.1.2",
      "tested_components": [
        {"name": "@mnemosyne/design-language", "version": "0.1.2"}
      ],
      "minimum_version": "0.1.2",
      "evidence_status": "verified",
      "working_tree": "clean",
      "required_capabilities": [
        "mnemosyne-design-language.interface-patterns.v1"
      ],
      "missing_required_capabilities": [],
      "wire_contracts": []
    }
  },
  "blocking_gates": []
}
